{
  "elf": {
    "path": "data/isa/rv32um/remu/firmware.elf",
    "sha256": "ff8da40eb9c79142d0256421113da0860250d7a2db86d52d186502517c5d9bc8"
  },
  "endianness": "little",
  "entry": "0x00000000",
  "isa": {
    "mabi": "ilp32",
    "march": "rv32im_zicsr",
    "xlen": 32
  },
  "kind": "software_image",
  "memory_map_sha256": "41ec5a5b5db585aec3d0486b037545eb3a8d0a08bfb64c89f8b291623eb81298",
  "profile": "riscv-tests/rv32um/remu",
  "regions": [
    {
      "base": "0x00000000",
      "file": "data/isa/rv32um/remu/code.mem",
      "fill": "0x00000000",
      "name": "CODE",
      "sha256": "6aeff9a15d1c87dd0abac899ddbfdbda71ce08f9945e8ee47eeea9cb0aa925e6",
      "size": 65536,
      "stored_words": 82,
      "used": 328
    },
    {
      "base": "0x10000000",
      "file": "data/isa/rv32um/remu/data.mem",
      "fill": "0x00000000",
      "name": "DATA",
      "sha256": "22dbe6b7b70a64966e31813e597db3e863492d341bee2fb05c0e8864773387af",
      "size": 65536,
      "stored_words": 1,
      "used": 0
    }
  ],
  "schema_version": 2,
  "segments": [
    {
      "address": "0x00000000",
      "file_size": 328,
      "flags": 5,
      "memory_size": 328,
      "region": "CODE"
    }
  ],
  "test_status": {
    "base": "0x30002000",
    "fail_magic": "0x4641494c",
    "pass_magic": "0x50415353"
  },
  "word_format": {
    "address_unit": "word",
    "bits": 32,
    "hex_digits": 8
  }
}
