{
  "elf": {
    "path": "data/isa/rv32ui/srli/firmware.elf",
    "sha256": "357d84ad9cfe0d621604af53ba02b7687203f79136d554b8eef21b7332f62ecd"
  },
  "endianness": "little",
  "entry": "0x00000000",
  "isa": {
    "mabi": "ilp32",
    "march": "rv32i_zicsr_zifencei",
    "xlen": 32
  },
  "kind": "software_image",
  "memory_map_sha256": "bc390074e0cbee766378852ab0dfaeec8d03cd3c0e443c47f6f415ca121d531d",
  "profile": "riscv-tests/rv32ui/srli",
  "regions": [
    {
      "base": "0x00000000",
      "file": "data/isa/rv32ui/srli/code.mem",
      "fill": "0x00000000",
      "name": "CODE",
      "sha256": "a20a918a3306a42efa45c8bf4a12f70a76a1bbe1085a8808065303839e6a3afe",
      "size": 65536,
      "stored_words": 195,
      "used": 780
    },
    {
      "base": "0x10000000",
      "file": "data/isa/rv32ui/srli/data.mem",
      "fill": "0x00000000",
      "name": "DATA",
      "sha256": "22dbe6b7b70a64966e31813e597db3e863492d341bee2fb05c0e8864773387af",
      "size": 65536,
      "stored_words": 1,
      "used": 0
    }
  ],
  "schema_version": 2,
  "segments": [
    {
      "address": "0x00000000",
      "file_size": 780,
      "flags": 5,
      "memory_size": 780,
      "region": "CODE"
    }
  ],
  "test_status": {
    "base": "0x30002000",
    "fail_magic": "0x4641494c",
    "pass_magic": "0x50415353"
  },
  "word_format": {
    "address_unit": "word",
    "bits": 32,
    "hex_digits": 8
  }
}
