{
  "elf": {
    "path": "data/isa/rv32ui/add/firmware.elf",
    "sha256": "cec1cc1af96da64e0da923fa5ec413ce6426e6fbc4a76eb6993b1968661d443a"
  },
  "endianness": "little",
  "entry": "0x00000000",
  "isa": {
    "mabi": "ilp32",
    "march": "rv32i_zicsr_zifencei",
    "xlen": 32
  },
  "kind": "software_image",
  "memory_map_sha256": "bc390074e0cbee766378852ab0dfaeec8d03cd3c0e443c47f6f415ca121d531d",
  "profile": "riscv-tests/rv32ui/add",
  "regions": [
    {
      "base": "0x00000000",
      "file": "data/isa/rv32ui/add/code.mem",
      "fill": "0x00000000",
      "name": "CODE",
      "sha256": "183357b8228a6e2de46eb00f95e3e171115b88a179c6692eb388c31ad6babb2f",
      "size": 65536,
      "stored_words": 339,
      "used": 1356
    },
    {
      "base": "0x10000000",
      "file": "data/isa/rv32ui/add/data.mem",
      "fill": "0x00000000",
      "name": "DATA",
      "sha256": "22dbe6b7b70a64966e31813e597db3e863492d341bee2fb05c0e8864773387af",
      "size": 65536,
      "stored_words": 1,
      "used": 0
    }
  ],
  "schema_version": 2,
  "segments": [
    {
      "address": "0x00000000",
      "file_size": 1356,
      "flags": 5,
      "memory_size": 1356,
      "region": "CODE"
    }
  ],
  "test_status": {
    "base": "0x30002000",
    "fail_magic": "0x4641494c",
    "pass_magic": "0x50415353"
  },
  "word_format": {
    "address_unit": "word",
    "bits": 32,
    "hex_digits": 8
  }
}
