{
  "elf": {
    "path": "data/isa/rv32ud/ldst/firmware.elf",
    "sha256": "63a4020b7948e56437f2dc17f303cf978c8fc36c21d340ce239d08f712572725"
  },
  "endianness": "little",
  "entry": "0x00000000",
  "isa": {
    "mabi": "ilp32",
    "march": "rv32imfd_zicsr",
    "xlen": 32
  },
  "kind": "software_image",
  "memory_map_sha256": "bc390074e0cbee766378852ab0dfaeec8d03cd3c0e443c47f6f415ca121d531d",
  "profile": "riscv-tests/rv32ud/ldst",
  "regions": [
    {
      "base": "0x00000000",
      "file": "data/isa/rv32ud/ldst/code.mem",
      "fill": "0x00000000",
      "name": "CODE",
      "sha256": "8b7c7543595e92f72e5c5bc9b447d531113618ce926422478827d5b807dc8de5",
      "size": 65536,
      "stored_words": 88,
      "used": 352
    },
    {
      "base": "0x10000000",
      "file": "data/isa/rv32ud/ldst/data.mem",
      "fill": "0x00000000",
      "name": "DATA",
      "sha256": "808ca3def1d2d3c26889794286b2e30361d22a541a72d652e9b09d3840c9ec29",
      "size": 65536,
      "stored_words": 20,
      "used": 80
    }
  ],
  "schema_version": 2,
  "segments": [
    {
      "address": "0x00000000",
      "file_size": 352,
      "flags": 5,
      "memory_size": 352,
      "region": "CODE"
    },
    {
      "address": "0x10000000",
      "file_size": 80,
      "flags": 6,
      "memory_size": 80,
      "region": "DATA"
    }
  ],
  "test_status": {
    "base": "0x30002000",
    "fail_magic": "0x4641494c",
    "pass_magic": "0x50415353"
  },
  "word_format": {
    "address_unit": "word",
    "bits": 32,
    "hex_digits": 8
  }
}
