{
  "elf": {
    "path": "data/isa/rv32um/mul/firmware.elf",
    "sha256": "ccfe32cb12ea847c07e52fa1b22b7d8ddc2c685eb3fe5d3f2f3ac634975e27fc"
  },
  "endianness": "little",
  "entry": "0x00000000",
  "isa": {
    "mabi": "ilp32",
    "march": "rv32im_zicsr",
    "xlen": 32
  },
  "kind": "software_image",
  "memory_map_sha256": "41ec5a5b5db585aec3d0486b037545eb3a8d0a08bfb64c89f8b291623eb81298",
  "profile": "riscv-tests/rv32um/mul",
  "regions": [
    {
      "base": "0x00000000",
      "file": "data/isa/rv32um/mul/code.mem",
      "fill": "0x00000000",
      "name": "CODE",
      "sha256": "ab29290f2489ccf5fd880b16aa79ff312d4162b0a352b1507e9c08955e77753d",
      "size": 65536,
      "stored_words": 333,
      "used": 1332
    },
    {
      "base": "0x10000000",
      "file": "data/isa/rv32um/mul/data.mem",
      "fill": "0x00000000",
      "name": "DATA",
      "sha256": "22dbe6b7b70a64966e31813e597db3e863492d341bee2fb05c0e8864773387af",
      "size": 65536,
      "stored_words": 1,
      "used": 0
    }
  ],
  "schema_version": 2,
  "segments": [
    {
      "address": "0x00000000",
      "file_size": 1332,
      "flags": 5,
      "memory_size": 1332,
      "region": "CODE"
    }
  ],
  "test_status": {
    "base": "0x30002000",
    "fail_magic": "0x4641494c",
    "pass_magic": "0x50415353"
  },
  "word_format": {
    "address_unit": "word",
    "bits": 32,
    "hex_digits": 8
  }
}
