{
  "elf": {
    "path": "data/isa/rv32ui/simple/firmware.elf",
    "sha256": "18c623f55b4b6f3ac8792b78d9f8e523bb49fdde0710a3785ce4c9c6c967a367"
  },
  "endianness": "little",
  "entry": "0x00000000",
  "isa": {
    "mabi": "ilp32",
    "march": "rv32i_zicsr",
    "xlen": 32
  },
  "kind": "software_image",
  "memory_map_sha256": "bc390074e0cbee766378852ab0dfaeec8d03cd3c0e443c47f6f415ca121d531d",
  "profile": "riscv-tests/rv32ui/simple",
  "regions": [
    {
      "base": "0x00000000",
      "file": "data/isa/rv32ui/simple/code.mem",
      "fill": "0x00000000",
      "name": "CODE",
      "sha256": "79b3899c78d7663947f0f4723f9533f49189cfec729003b84eea909f182d97a0",
      "size": 65536,
      "stored_words": 18,
      "used": 72
    },
    {
      "base": "0x10000000",
      "file": "data/isa/rv32ui/simple/data.mem",
      "fill": "0x00000000",
      "name": "DATA",
      "sha256": "22dbe6b7b70a64966e31813e597db3e863492d341bee2fb05c0e8864773387af",
      "size": 65536,
      "stored_words": 1,
      "used": 0
    }
  ],
  "schema_version": 2,
  "segments": [
    {
      "address": "0x00000000",
      "file_size": 72,
      "flags": 5,
      "memory_size": 72,
      "region": "CODE"
    }
  ],
  "test_status": {
    "base": "0x30002000",
    "fail_magic": "0x4641494c",
    "pass_magic": "0x50415353"
  },
  "word_format": {
    "address_unit": "word",
    "bits": 32,
    "hex_digits": 8
  }
}
