{
  "elf": {
    "path": "data/isa/rv32ui/auipc/firmware.elf",
    "sha256": "200f29af8d3443a4f50975acafb4536ae5c3b57e704ff231b4a5b043b89e13de"
  },
  "endianness": "little",
  "entry": "0x00000000",
  "isa": {
    "mabi": "ilp32",
    "march": "rv32i_zicsr_zifencei",
    "xlen": 32
  },
  "kind": "software_image",
  "memory_map_sha256": "bc390074e0cbee766378852ab0dfaeec8d03cd3c0e443c47f6f415ca121d531d",
  "profile": "riscv-tests/rv32ui/auipc",
  "regions": [
    {
      "base": "0x00000000",
      "file": "data/isa/rv32ui/auipc/code.mem",
      "fill": "0x00000000",
      "name": "CODE",
      "sha256": "6da9f5a767b1a0b47a68318171ffd309e7bb3204b12d33edea474634859a0a03",
      "size": 65536,
      "stored_words": 45,
      "used": 180
    },
    {
      "base": "0x10000000",
      "file": "data/isa/rv32ui/auipc/data.mem",
      "fill": "0x00000000",
      "name": "DATA",
      "sha256": "22dbe6b7b70a64966e31813e597db3e863492d341bee2fb05c0e8864773387af",
      "size": 65536,
      "stored_words": 1,
      "used": 0
    }
  ],
  "schema_version": 2,
  "segments": [
    {
      "address": "0x00000000",
      "file_size": 180,
      "flags": 5,
      "memory_size": 180,
      "region": "CODE"
    }
  ],
  "test_status": {
    "base": "0x30002000",
    "fail_magic": "0x4641494c",
    "pass_magic": "0x50415353"
  },
  "word_format": {
    "address_unit": "word",
    "bits": 32,
    "hex_digits": 8
  }
}
