{
  "elf": {
    "path": "data/isa/rv32mi/pmpaddr/firmware.elf",
    "sha256": "184f7b1e9e9312ee4cd0e24a64e60bc2cfa8609df43bc803eab05b17d0fbdb31"
  },
  "endianness": "little",
  "entry": "0x00000000",
  "isa": {
    "mabi": "ilp32",
    "march": "rv32imf_zicsr_zicntr_zifencei",
    "xlen": 32
  },
  "kind": "software_image",
  "memory_map_sha256": "41ec5a5b5db585aec3d0486b037545eb3a8d0a08bfb64c89f8b291623eb81298",
  "profile": "riscv-tests/rv32mi/pmpaddr",
  "regions": [
    {
      "base": "0x00000000",
      "file": "data/isa/rv32mi/pmpaddr/code.mem",
      "fill": "0x00000000",
      "name": "CODE",
      "sha256": "d9dd3d1600af0b0d86f5a1fbc0f7dbe748f4f052173bb342a8eafa475ade4279",
      "size": 65536,
      "stored_words": 86,
      "used": 344
    },
    {
      "base": "0x10000000",
      "file": "data/isa/rv32mi/pmpaddr/data.mem",
      "fill": "0x00000000",
      "name": "DATA",
      "sha256": "22dbe6b7b70a64966e31813e597db3e863492d341bee2fb05c0e8864773387af",
      "size": 65536,
      "stored_words": 1,
      "used": 0
    }
  ],
  "schema_version": 2,
  "segments": [
    {
      "address": "0x00000000",
      "file_size": 344,
      "flags": 5,
      "memory_size": 344,
      "region": "CODE"
    }
  ],
  "test_status": {
    "base": "0x30002000",
    "fail_magic": "0x4641494c",
    "pass_magic": "0x50415353"
  },
  "word_format": {
    "address_unit": "word",
    "bits": 32,
    "hex_digits": 8
  }
}
