{
  "elf": {
    "path": "data/isa/rv32ud/fcmp/firmware.elf",
    "sha256": "7d179f3b72032a16bac6a63cd723bad73c6d78171255eb3e3c757ab31fdbc6ac"
  },
  "endianness": "little",
  "entry": "0x00000000",
  "isa": {
    "mabi": "ilp32",
    "march": "rv32imfd_zicsr",
    "xlen": 32
  },
  "kind": "software_image",
  "memory_map_sha256": "bc390074e0cbee766378852ab0dfaeec8d03cd3c0e443c47f6f415ca121d531d",
  "profile": "riscv-tests/rv32ud/fcmp",
  "regions": [
    {
      "base": "0x00000000",
      "file": "data/isa/rv32ud/fcmp/code.mem",
      "fill": "0x00000000",
      "name": "CODE",
      "sha256": "38ecb3ffdb690c55dd3dcd17498a85a281240ed000b1d8509294c81beb690933",
      "size": 65536,
      "stored_words": 256,
      "used": 1024
    },
    {
      "base": "0x10000000",
      "file": "data/isa/rv32ud/fcmp/data.mem",
      "fill": "0x00000000",
      "name": "DATA",
      "sha256": "5214e5b98118e488ee3518eb03ae21546874baf7b1876d333c89277e78489f3d",
      "size": 65536,
      "stored_words": 120,
      "used": 480
    }
  ],
  "schema_version": 2,
  "segments": [
    {
      "address": "0x00000000",
      "file_size": 1024,
      "flags": 5,
      "memory_size": 1024,
      "region": "CODE"
    },
    {
      "address": "0x10000000",
      "file_size": 480,
      "flags": 6,
      "memory_size": 480,
      "region": "DATA"
    }
  ],
  "test_status": {
    "base": "0x30002000",
    "fail_magic": "0x4641494c",
    "pass_magic": "0x50415353"
  },
  "word_format": {
    "address_unit": "word",
    "bits": 32,
    "hex_digits": 8
  }
}
