{
  "elf": {
    "path": "data/isa/rv32ui/lbu/firmware.elf",
    "sha256": "a94ac1e3bdaee3f5f19a82bc6f8d34cee6519d48d56c778240cbc7568bacaf8e"
  },
  "endianness": "little",
  "entry": "0x00000000",
  "isa": {
    "mabi": "ilp32",
    "march": "rv32i_zicsr_zifencei",
    "xlen": 32
  },
  "kind": "software_image",
  "memory_map_sha256": "41ec5a5b5db585aec3d0486b037545eb3a8d0a08bfb64c89f8b291623eb81298",
  "profile": "riscv-tests/rv32ui/lbu",
  "regions": [
    {
      "base": "0x00000000",
      "file": "data/isa/rv32ui/lbu/code.mem",
      "fill": "0x00000000",
      "name": "CODE",
      "sha256": "cfb0ffa6e6708fc52389a6f7b77d26e823123c5580033c45f29a6a75dc4f0c5e",
      "size": 65536,
      "stored_words": 182,
      "used": 728
    },
    {
      "base": "0x10000000",
      "file": "data/isa/rv32ui/lbu/data.mem",
      "fill": "0x00000000",
      "name": "DATA",
      "sha256": "9323f6844f517886f9d5dcc768b39a34146c2bcab8cb9151ca7eab22fc1c856a",
      "size": 65536,
      "stored_words": 4,
      "used": 16
    }
  ],
  "schema_version": 2,
  "segments": [
    {
      "address": "0x00000000",
      "file_size": 728,
      "flags": 5,
      "memory_size": 728,
      "region": "CODE"
    },
    {
      "address": "0x10000000",
      "file_size": 16,
      "flags": 6,
      "memory_size": 16,
      "region": "DATA"
    }
  ],
  "test_status": {
    "base": "0x30002000",
    "fail_magic": "0x4641494c",
    "pass_magic": "0x50415353"
  },
  "word_format": {
    "address_unit": "word",
    "bits": 32,
    "hex_digits": 8
  }
}
