{
  "elf": {
    "path": "data/isa/rv32ud/fadd/firmware.elf",
    "sha256": "b7291d933e071c99688635ea0f1f68105173e1a2c206007b3199331ea06682f6"
  },
  "endianness": "little",
  "entry": "0x00000000",
  "isa": {
    "mabi": "ilp32",
    "march": "rv32imfd_zicsr",
    "xlen": 32
  },
  "kind": "software_image",
  "memory_map_sha256": "bc390074e0cbee766378852ab0dfaeec8d03cd3c0e443c47f6f415ca121d531d",
  "profile": "riscv-tests/rv32ud/fadd",
  "regions": [
    {
      "base": "0x00000000",
      "file": "data/isa/rv32ud/fadd/code.mem",
      "fill": "0x00000000",
      "name": "CODE",
      "sha256": "cc8ce72721253b5aaa115ab4304a8660433c020818794ce2967c926db8d2e1aa",
      "size": 65536,
      "stored_words": 201,
      "used": 804
    },
    {
      "base": "0x10000000",
      "file": "data/isa/rv32ud/fadd/data.mem",
      "fill": "0x00000000",
      "name": "DATA",
      "sha256": "adc32614d419fac413f404460563ae5e3fa2fa8c3124e9c9f603460b8bd2ae78",
      "size": 65536,
      "stored_words": 80,
      "used": 320
    }
  ],
  "schema_version": 2,
  "segments": [
    {
      "address": "0x00000000",
      "file_size": 804,
      "flags": 5,
      "memory_size": 804,
      "region": "CODE"
    },
    {
      "address": "0x10000000",
      "file_size": 320,
      "flags": 6,
      "memory_size": 320,
      "region": "DATA"
    }
  ],
  "test_status": {
    "base": "0x30002000",
    "fail_magic": "0x4641494c",
    "pass_magic": "0x50415353"
  },
  "word_format": {
    "address_unit": "word",
    "bits": 32,
    "hex_digits": 8
  }
}
