{
  "elf": {
    "path": "data/isa/rv32ui/srai/firmware.elf",
    "sha256": "5e80d09ca11612c08b36c41c9596aec9f3f1c0cfe2aa6e9c5c01463f10b81b53"
  },
  "endianness": "little",
  "entry": "0x00000000",
  "isa": {
    "mabi": "ilp32",
    "march": "rv32i_zicsr_zifencei",
    "xlen": 32
  },
  "kind": "software_image",
  "memory_map_sha256": "bc390074e0cbee766378852ab0dfaeec8d03cd3c0e443c47f6f415ca121d531d",
  "profile": "riscv-tests/rv32ui/srai",
  "regions": [
    {
      "base": "0x00000000",
      "file": "data/isa/rv32ui/srai/code.mem",
      "fill": "0x00000000",
      "name": "CODE",
      "sha256": "8ae4e63c7880ad7d3cb9c3f53aaa96c1c7ad0d5e44718bf4f9cfd088a593aef8",
      "size": 65536,
      "stored_words": 201,
      "used": 804
    },
    {
      "base": "0x10000000",
      "file": "data/isa/rv32ui/srai/data.mem",
      "fill": "0x00000000",
      "name": "DATA",
      "sha256": "22dbe6b7b70a64966e31813e597db3e863492d341bee2fb05c0e8864773387af",
      "size": 65536,
      "stored_words": 1,
      "used": 0
    }
  ],
  "schema_version": 2,
  "segments": [
    {
      "address": "0x00000000",
      "file_size": 804,
      "flags": 5,
      "memory_size": 804,
      "region": "CODE"
    }
  ],
  "test_status": {
    "base": "0x30002000",
    "fail_magic": "0x4641494c",
    "pass_magic": "0x50415353"
  },
  "word_format": {
    "address_unit": "word",
    "bits": 32,
    "hex_digits": 8
  }
}
