{
  "elf": {
    "path": "data/isa/rv32mi/sw-misaligned/firmware.elf",
    "sha256": "1867b2ed024bd31aed63da3914035a24c463dd89061f032fc9e0f54833295e3a"
  },
  "endianness": "little",
  "entry": "0x00000000",
  "isa": {
    "mabi": "ilp32",
    "march": "rv32imfd_zicsr_zicntr_zifencei",
    "xlen": 32
  },
  "kind": "software_image",
  "memory_map_sha256": "bc390074e0cbee766378852ab0dfaeec8d03cd3c0e443c47f6f415ca121d531d",
  "profile": "riscv-tests/rv32mi/sw-misaligned",
  "regions": [
    {
      "base": "0x00000000",
      "file": "data/isa/rv32mi/sw-misaligned/code.mem",
      "fill": "0x00000000",
      "name": "CODE",
      "sha256": "6bab34531d5f887f0eff28221de72c0072cf9b2ee2098f26e9eade2cc2cbc583",
      "size": 65536,
      "stored_words": 90,
      "used": 360
    },
    {
      "base": "0x10000000",
      "file": "data/isa/rv32mi/sw-misaligned/data.mem",
      "fill": "0x00000000",
      "name": "DATA",
      "sha256": "e3d2d31361e72c16124caa72f2f57f784c691e5f4bcd3e8f1f3fb04fb711f393",
      "size": 65536,
      "stored_words": 4,
      "used": 16
    }
  ],
  "schema_version": 2,
  "segments": [
    {
      "address": "0x00000000",
      "file_size": 360,
      "flags": 5,
      "memory_size": 360,
      "region": "CODE"
    },
    {
      "address": "0x10000000",
      "file_size": 16,
      "flags": 6,
      "memory_size": 16,
      "region": "DATA"
    }
  ],
  "test_status": {
    "base": "0x30002000",
    "fail_magic": "0x4641494c",
    "pass_magic": "0x50415353"
  },
  "word_format": {
    "address_unit": "word",
    "bits": 32,
    "hex_digits": 8
  }
}
