{
  "elf": {
    "path": "data/isa/rv32mi/breakpoint/firmware.elf",
    "sha256": "40b308b0527cae3e8cd6cd2286aa0711cee956490e16c3c40c7768fae648aafe"
  },
  "endianness": "little",
  "entry": "0x00000000",
  "isa": {
    "mabi": "ilp32",
    "march": "rv32imfd_zicsr_zicntr_zifencei",
    "xlen": 32
  },
  "kind": "software_image",
  "memory_map_sha256": "bc390074e0cbee766378852ab0dfaeec8d03cd3c0e443c47f6f415ca121d531d",
  "profile": "riscv-tests/rv32mi/breakpoint",
  "regions": [
    {
      "base": "0x00000000",
      "file": "data/isa/rv32mi/breakpoint/code.mem",
      "fill": "0x00000000",
      "name": "CODE",
      "sha256": "14efb54c11074b1bb4d97dcdfbde710e1b0452cc5d50b58fd7472cd579f8cb0f",
      "size": 65536,
      "stored_words": 103,
      "used": 412
    },
    {
      "base": "0x10000000",
      "file": "data/isa/rv32mi/breakpoint/data.mem",
      "fill": "0x00000000",
      "name": "DATA",
      "sha256": "e3d2d31361e72c16124caa72f2f57f784c691e5f4bcd3e8f1f3fb04fb711f393",
      "size": 65536,
      "stored_words": 4,
      "used": 16
    }
  ],
  "schema_version": 2,
  "segments": [
    {
      "address": "0x00000000",
      "file_size": 412,
      "flags": 5,
      "memory_size": 412,
      "region": "CODE"
    },
    {
      "address": "0x10000000",
      "file_size": 16,
      "flags": 6,
      "memory_size": 16,
      "region": "DATA"
    }
  ],
  "test_status": {
    "base": "0x30002000",
    "fail_magic": "0x4641494c",
    "pass_magic": "0x50415353"
  },
  "word_format": {
    "address_unit": "word",
    "bits": 32,
    "hex_digits": 8
  }
}
